{
  "schema_version": 1,
  "minimum_trust": "declared",
  "required_source_approval": "approved",
  "allow_advisory_contracts": false,
  "allowed_side_effects": ["read-only", "workspace-write", "external-write", "destructive"],
  "approval_required_for": ["external-write", "destructive"],
  "allowed_tools": ["filesystem-read", "filesystem-search", "runtime-read", "test-execution", "version-control-read"],
  "network_allowed": false,
  "allowed_data_classifications": ["public", "internal", "controlled"],
  "model_authorizations": [
    {
      "provider": "local",
      "models": ["*"],
      "capabilities": ["reasoning"],
      "data_classifications": ["public", "internal", "controlled"]
    }
  ]
}
